{
  "schema_version": 1,
  "event_id": "task-fe110-adsorption-force24-reviewed-20261018",
  "occurred_at": "2026-10-18T06:47:14+00:00",
  "recorded_at": "2026-10-18T06:47:14+00:00",
  "event_type": "task_updated",
  "entity": {"kind": "task", "id": "task-current", "module": "adsorption_workflow"},
  "summary": "Authorized24-frame GPU force diagnostic completed;frozen2185 improves every sampled DFT frame but06_C ML failure-boundary DFT error remains unmeasured.",
  "evidence": [
    {
      "locator": "docs/reviews/fe110_adsorption_force24_2185_20261018.md",
      "sha256": "11d0e06ab44ad8c3283490e8b8708c43fea8d96524089e0c29dc64eb26127363",
      "authority": "repository_document",
      "observed_at": "2026-10-18T06:47:14+00:00"
    },
    {
      "locator": "archive/fe110_adsorption_validation_20261018/authorization_force24.md",
      "sha256": "fcc61a7e44181e2dfb777146ebad3c488abbc7c56502fb338a6176e40f2a44e0",
      "authority": "user_authorization",
      "observed_at": "2026-10-18T06:47:14+00:00"
    },
    {
      "locator": "calculations/fe110_c2_adsorption_06_10_20261012/adsorption_force24_2185_20261018_v1/validation_request.json",
      "sha256": "44dbfb9f4f34138676cab32d0c36aec70cc88ea49d7a3052213141ec2a6fc442",
      "authority": "repository_document",
      "observed_at": "2026-10-18T06:47:14+00:00"
    },
    {
      "locator": "calculations/fe110_c2_adsorption_06_10_20261012/adsorption_force24_2185_20261018_v1/force_comparison_review.json",
      "sha256": "2b1614e119d3644487ea5b4c14078bcb61c67f4cef8668f4205f3f1afbf9c943",
      "authority": "module_validation",
      "observed_at": "2026-10-18T06:47:14+00:00"
    },
    {
      "locator": "calculations/fe110_c2_adsorption_06_10_20261012/adsorption_force24_2185_20261018_v1/returned/output/producer_exit_record.json",
      "sha256": "94f2a54ea960f93d1b96422bc1b3a958bdfb78bc3afe603e999df0f242f8d12a",
      "authority": "calculation_file",
      "observed_at": "2026-10-18T06:47:14+00:00"
    },
    {
      "locator": "calculations/fe110_c2_adsorption_06_10_20261012/adsorption_force24_2185_20261018_v1/validation_junit.xml",
      "sha256": "48f5a37b4196acf16fc35b6e05d952bccc63f72dd68f6c452c6646d4461a2d52",
      "authority": "module_validation",
      "observed_at": "2026-10-18T06:47:14+00:00"
    }
  ],
  "review": {"required": false, "reason_codes": [], "status": "not_required"},
  "supersedes": ["task-fe110-adsorption-2185-validated-mixed-20261018"],
  "payload": {
    "objective": "Improve adsorption acceleration using verified force and geometry evidence without promoting an unreliable raw-seed optimizer.",
    "phase": "active",
    "current_evidence": [
      "User-authorized24-frame force-only GPU1 batch completed;PID2580552 actual cuda:0;producer exit0 after8.59s;nine returned files hash-verified;no relaxation/training/VASP/model change.",
      "Existing24DFT frames:adsorbate force-vectorRMSE0.225356→0.123129eV/A(-45.36%);all24 individual frame RMSEs improve;Fe/C/O/H pooled groups improve.",
      "06_C8-frameRMSE0.199685→0.090909;early steps1/2/5 0.216999→0.121481;intermediate33/66/98 0.194078→0.083371;last130/131 0.179902→0.022261eV/A.",
      "The24 frames remain untrained but were previously screened,not pristine independent heldout. Previous16heldout validation remains outside fitting and epoch selection.",
      "Prior06_C raw-seed prediction loses target motif toCO+C+H despite improved forces on successfulDFT trajectory. Actual failedML-boundary DFT forces remain unmeasured;model error versus basin selection is unresolved.",
      "No measured VASP step/time speedup,no global model promotion,no active GPU run from this diagnostic;82 scoped tests and old-package compatibility verification passed."
    ],
    "one_executable_step": "Select pre/post motif-loss06_C structures from its already savedML trajectory and prepare a bounded compatible same-structure VASP force-label comparison for review,before deciding another fine-tune.",
    "submission_boundary": "The one authorized24-frame force-only GPU batch is finished. No further GPU optimization,training,VASP or default-model promotion is authorized;future expensive execution requires separate authority.",
    "done_when": [
      "Completed frozen-checkpoint force/geometry diagnostics and06_C failure evidence are preserved without a general acceleration claim.",
      "ActualML failure-boundary DFT force errors are reviewed before selecting targeted adaptation versus a basin/path strategy.",
      "Any adopted acceleration is checked against compatible matched VASP steps/time and reviewed final chemistry."
    ],
    "constraints": [
      "Do not use observed16heldout structures for gradients or retrospective epoch selection;new24 frames remain untrained.",
      "Force RMSE improvement on successfulDFT trajectories does not establish failedML endpoint stability or prove the cause of motif loss.",
      "Preserve existing checkpoints,VASP parameters,other jobs and backend roles;no silent model adoption or automatic expensive retry."
    ],
    "authoritative_references": [
      "configs/execution_backends.yaml",
      "modules/adsorption_workflow/README.md",
      "docs/reviews/fe110_adsorption_force24_2185_20261018.md",
      "calculations/fe110_c2_adsorption_06_10_20261012/adsorption_force24_2185_20261018_v1/force_comparison_review.json"
    ]
  }
}
