{
  "schema_version": 1,
  "event_id": "review-869581767e4695277a9a3b59",
  "event_type": "review_decision",
  "entity": {
    "kind": "proposal",
    "id": "proposal-2fd7ccf9f688e2c57d1646b3",
    "module": "state_handoff"
  },
  "occurred_at": "2026-08-08T04:25:29Z",
  "recorded_at": "2026-08-08T04:25:29Z",
  "summary": "approve proposal proposal-2fd7ccf9f688e2c57d1646b3",
  "payload": {
    "proposal_id": "proposal-2fd7ccf9f688e2c57d1646b3",
    "decision": "approve",
    "reviewer": "user",
    "reason": "",
    "reviewed_event_id": "repository-items-420067fc7a6d583991bfb1b8",
    "reviewed_event_sha256": "32b3636b939bbf885e085bad6ae0b3b660c4a26632ac6f1fbcddba4ea386b1cc"
  },
  "evidence": [],
  "supersedes": [],
  "review": {
    "required": false,
    "reason_codes": [],
    "status": "not_required"
  }
}
