{
  "schema_version": 1,
  "event_id": "review-d5e445a16e15687e7318b869",
  "event_type": "review_decision",
  "entity": {
    "kind": "proposal",
    "id": "proposal-7668fe9fd1b360f422390e35",
    "module": "state_handoff"
  },
  "occurred_at": "2026-08-27T14:00:38Z",
  "recorded_at": "2026-08-27T14:00:38Z",
  "summary": "approve proposal proposal-7668fe9fd1b360f422390e35",
  "payload": {
    "proposal_id": "proposal-7668fe9fd1b360f422390e35",
    "decision": "approve",
    "reviewer": "user",
    "reason": "User explicitly approved applying this exact refreshed module-map proposal.",
    "reviewed_event_id": "module-gate-transition-state-search-mz73-preflight-passed-submission-decision-20260827",
    "reviewed_event_sha256": "fd0ae363ac33651a47cbca43cc21a852201819019955c719f510cd2cf5d1ffea"
  },
  "evidence": [],
  "supersedes": [],
  "review": {
    "required": false,
    "reason_codes": [],
    "status": "not_required"
  }
}
