{
  "schema_version": 1,
  "occurred_at": "2026-09-10T07:04:53.730145+00:00",
  "recorded_at": "2026-09-10T07:04:53.730145+00:00",
  "evidence": [
    {
      "locator": "docs/reviews/valley9748648_accepted_20260910.md",
      "sha256": "355358f85226bcecda7514d5e4bbac6f9c45acce7c76c295e10af54c43a1f91e",
      "authority": "module_validation",
      "observed_at": "2026-09-10T06:44:43.914063+00:00"
    },
    {
      "locator": "calculations/fe110_c2ho_h_to_c2h2o_ts_20260822/h_migration1357_valley06_relax_20260909/completed_review_20260910/registry_receipt.json",
      "sha256": "11c5d91cbb11fb12d92a3b487435ceb3253454ae732fe13cc35fcc1fd5a1024e",
      "authority": "calculation_registry",
      "observed_at": "2026-09-10T06:44:43.914063+00:00"
    },
    {
      "locator": "calculations/fe110_c2ho_h_to_c2h2o_ts_20260822/h_migration1357_valley06_relax_20260909/completed_review_20260910/parsed_review_evidence.json",
      "sha256": "adcfdc6e450edca0418580a3f9a4d72b08434c8ef3edfc7b495293b926706a9d",
      "authority": "module_validation",
      "observed_at": "2026-09-10T06:44:43.914063+00:00"
    },
    {
      "locator": "docs/reviews/oh_ts_accepted_barrier_20260910.md",
      "sha256": "3af5f8283f023f88fae40fdf72bb6f4edf91b7b63376a378b66b0d04ab59cd33",
      "authority": "repository_document",
      "observed_at": "2026-09-10T06:44:43.914063+00:00"
    },
    {
      "locator": "docs/reviews/int06_mid_path_prepared_20260910.md",
      "sha256": "be8be3437bd4604edefe1db23407763bb006556ea81b4590f6f43b499023dcda",
      "authority": "repository_document",
      "observed_at": "2026-09-10T07:04:53.730145+00:00"
    }
  ],
  "review": {
    "required": false,
    "reason_codes": [],
    "status": "not_required"
  },
  "event_id": "state-int06-mid-inputs-prepared-20260910",
  "event_type": "state_observed",
  "entity": {
    "kind": "state",
    "id": "active-fe-110-co-dissociation-test-current-gate",
    "module": "transition_state_search"
  },
  "summary": "Procedural update: prepared local NEB inputs; existing approved scientific results unchanged.",
  "payload": {
    "block_id": "active-fe-110-co-dissociation-test-current-gate",
    "section": "## Active Transition-State Gate",
    "title": "Active Gate - 2026-09-10 INT06-to-MID Inputs Prepared; Submission Authority Pending",
    "facts": [
      "9748648: LSF DONE; ordinary valley06 relaxation completed in 79 steps; electronic and force criteria passed (0.0177274761 eV/A < 0.020).",
      "INT06 accepted as intact C2HO* + H* mapped migration endpoint; final TOTEN -388.50564344 eV under fe110_converged_toten_sigma0p20_v1.",
      "Schema9 registry completion applied: 12 inserted records and one workflow projection change; receipt in h_migration1357_valley06_relax_20260909/completed_review_20260910/registry_receipt.json.",
      "IS-A -> INT06 and INT06 -> MID are two path intervals awaiting TS evidence; image02 remains an unresolved first-interval ML minimum.",
      "The previously accepted MID -> FS O-H TS and 1.28582718 eV forward electronic barrier remain complete; do not repeat.",
      "No new NEB/Dimer/frequency/static/GPU calculation submitted; no Hessian, exhaustive symmetry equivalence or complete migration-barrier claim.",
      "INT06 -> MID local input package prepared: 3 interior images, 96 cores; VTST movie/distance, exact-MIC geometry, INCAR and input preflight checks completed. Execution gate has no allowed submission action without exact-package user authority. No new calculation was submitted."
    ],
    "next_action": "Obtain exact-package authorization for INT06 -> MID ordinary NEB (3 images, 96 cores, NSW=300; bundle 1e34b1df2a0b4ee304cc2d5040e4fed365e0ead2421e049bba873cb232631735); then verify backend POTCAR, bind authorization, reevaluate the execution gate and submit only if SUBMIT_VASP is allowed.",
    "project_state_header": true
  },
  "supersedes": [
    "state-int06-9748648-reviewed-20260910"
  ]
}
