{
  "schema_version": 1,
  "event_id": "task-fe110-06c-boundary-force-compared-20261019",
  "occurred_at": "2026-10-19T03:51:45+00:00",
  "recorded_at": "2026-10-19T03:51:45+00:00",
  "event_type": "task_updated",
  "entity": {"kind": "task", "id": "task-current", "module": "adsorption_workflow"},
  "summary": "Three exact failure-boundary VASP labels and separately authorized dual-frozen-model GPU comparison complete;overall adsorbate error improves but local carbon errors worsen;no training or promotion.",
  "evidence": [
    {
      "locator": "docs/reviews/fe110_06c_boundary_force_comparison_20261019.md",
      "sha256": "5ea54ddca386a60c3d9ed867b347890009eca5152b101d9341e7171edd18b9b9",
      "authority": "repository_document",
      "observed_at": "2026-10-19T03:51:45+00:00"
    },
    {
      "locator": "archive/fe110_adsorption_validation_20261018/authorization_boundary_force_20261019.md",
      "sha256": "3f5164ce6ad049bb23940af93c72db5fac4f6fff58853d8db9ac57eae333e8c9",
      "authority": "user_authorization",
      "observed_at": "2026-10-19T03:51:45+00:00"
    },
    {
      "locator": "calculations/fe110_c2_adsorption_06_10_20261012/adsorption_06c_force_comparison_20261019_v1/dataset_review.json",
      "sha256": "7d2846f693b14a577faf509fe0fd2834e94ca9a516281c1a4af6f5f3f1accdff",
      "authority": "repository_document",
      "observed_at": "2026-10-19T03:51:45+00:00"
    },
    {
      "locator": "calculations/fe110_c2_adsorption_06_10_20261012/adsorption_06c_force_comparison_20261019_v1/validation_request.json",
      "sha256": "c276ba6e46b2aa0e109c8fa9753c0ee2d4b838efd811b484a9bf4593d8b1835b",
      "authority": "repository_document",
      "observed_at": "2026-10-19T03:51:45+00:00"
    },
    {
      "locator": "calculations/fe110_c2_adsorption_06_10_20261012/adsorption_06c_force_comparison_20261019_v1/force_comparison_review.json",
      "sha256": "e1a2d952c4f7cf018542e7634ea3e47e814970bcd68be044941833f22bee4bd7",
      "authority": "repository_document",
      "observed_at": "2026-10-19T03:51:45+00:00"
    },
    {
      "locator": "calculations/fe110_c2_adsorption_06_10_20261012/adsorption_06c_force_comparison_20261019_v1/scoped_tests.xml",
      "sha256": "46c8fea2e6ea392ea875daaf1f725de1df1c0d8ab945dbdb8ad148a6a64f9b33",
      "authority": "repository_document",
      "observed_at": "2026-10-19T03:51:45+00:00"
    }
  ],
  "review": {"required": false, "reason_codes": [], "status": "not_required"},
  "supersedes": ["task-fe110-06c-static-submitted-20261018"],
  "payload": {
    "objective": "Use the completed actualML failure-boundary comparison to choose a justified next adsorption-acceleration adjustment without promoting the current model or automatically training.",
    "phase": "active",
    "current_evidence": [
      "VASP9896148/9896149/9896150 are DONE,normal,EDIFF-converged,with complete finite49-atom forces,exact input/coordinate/POTCAR binding and full local/total magnetic records;SIGMA0.20 NSW0 unchanged.",
      "User separately authorized one3-structure/two-frozen-model GPU force batch. MZ73 GPU1 actual CUDA execution completed with producer exit0 in6.58s;9returned files verified,no scheduler job emulation.",
      "Pooled adsorbate vectorRMSE0.269503→0.228471eV/A (15.225% improvement);per-frame before/after/final0.232212→0.177792,0.296110→0.254448,0.276209→0.245445.",
      "C46 error worsens before0.121081→0.234470 and after0.234895→0.383298eV/A;pooled carbon RMSE worsens0.232396→0.258324,while O/H improve. MovableFe essentially unchanged/slightly worse.",
      "Final057 frozen2185 fmax0.093003 differs fromDFT0.337048eV/A. Bond projections show local residual errors,but three points do not establish a sole optimizer/basin/path cause or prove the fragmented DFT basin unstable.",
      "57scoped tests,compilation/import/Ruff and294-row CSV uniqueness/RMSE recomputation passed. Existing16heldout exclusions and24untrained frames unchanged;no new training,VASP,checkpoint promotion or accepted-energy registration."
    ],
    "one_executable_step": "Review whether to prepare a targeted carbon/local-Fe force correction request with adsorption replay and isolated validation;any further GPU training requires separate user authorization.",
    "submission_boundary": "ONE_AUTHORIZED_FORCE_INFERENCE_BATCH_COMPLETE:do not rerun it,train,promote,change old jobs or submit additional VASP under its consumed authority.",
    "done_when": [
      "ActualML failure-boundary exact-structure VASP forces are normal/electronically converged,complete and compatibility/hash-bound.",
      "Identical-POSCAR originalAQCat25/frozen2185 errors and key-bond force directions are reviewed before choosing targeted adaptation or a basin/geometry strategy.",
      "Any adopted acceleration is checked against compatible matched VASP steps/time and reviewed final chemistry."
    ],
    "constraints": [
      "Preserve the frozen3POSCARs,VASP raw outputs,actual checkpoint hashes,all raw forces and fixedFe0-17 metric exclusion. Force labels are not accepted adsorption minima or reportable energies.",
      "These3screened related failure points are not independent heldout validation. Keep16observed heldout and24untrained frames isolated;no automatic threshold-based training or model promotion.",
      "Only work reviews GPU returns;MZ73 is inference/training backend and sunboquan-codex is VASP backend. Preserve credentials and other users' processes."
    ],
    "authoritative_references": [
      "configs/execution_backends.yaml",
      "docs/reviews/fe110_06c_boundary_force_comparison_20261019.md",
      "archive/fe110_adsorption_validation_20261018/authorization_boundary_force_20261019.md",
      "calculations/fe110_c2_adsorption_06_10_20261012/adsorption_06c_force_comparison_20261019_v1/force_comparison_review.json",
      "calculations/fe110_c2_adsorption_06_10_20261012/adsorption_06c_force_comparison_20261019_v1/per_atom_force_errors.csv"
    ]
  }
}
