{
  "schema_version": 1,
  "event_id": "review-97eb4d5858c32c4567014e08",
  "event_type": "review_decision",
  "entity": {
    "kind": "proposal",
    "id": "proposal-0c17ac56cf783373094f48c6",
    "module": "state_handoff"
  },
  "occurred_at": "2026-08-06T16:29:33Z",
  "recorded_at": "2026-08-06T16:29:33Z",
  "summary": "reject proposal proposal-0c17ac56cf783373094f48c6",
  "payload": {
    "proposal_id": "proposal-0c17ac56cf783373094f48c6",
    "decision": "reject",
    "reviewer": "user",
    "reason": "User rejected VFA grading as a Dimer TS acceptance step on 2026-08-07.",
    "reviewed_event_id": "state-fe110-co-dimer-mode-accepted-merge-20260807",
    "reviewed_event_sha256": "4f051766dab6d845208e1238804f003cf0a3fd8a3aee50825600cca649ee6509"
  },
  "evidence": [],
  "supersedes": [],
  "review": {
    "required": false,
    "reason_codes": [],
    "status": "not_required"
  }
}
